size,num_rooms,rent_price,location,url
270 m²,T2,"1,300€/month","rua da Venezuela, 37, Bairro de Santa Cruz, Benfica",https://www.idealista.pt/en/imovel/34091330/
290 m²,T2,"2,100€/month","avenida Duque de Loulé, Nn, Av. da Liberdade - Marquês de Pombal, Santo António",https://www.idealista.pt/en/imovel/34089711/
285 m²,T2,"1,150€/month","rua Eng Quartim Graça, Santa Clara, Lisboa",https://www.idealista.pt/en/imovel/28885618/
155 m²,T1,"1,600€/month","avenida Duque de Loulé, Nn, Av. da Liberdade - Marquês de Pombal, Santo António",https://www.idealista.pt/en/imovel/34089607/
149 m²,T1,"1,150€/month",,https://www.idealista.pt/en/imovel/34091264/
150 m²,T1,"1,960€/monthGarageoptional100 €/month","avenida António Augusto de Aguiar, Bairro Azul - Parque Eduardo VII, Avenidas Novas",https://www.idealista.pt/en/imovel/33863895/
143 m²,T1,"1,100€/month","rua Carvalho Araújo, Alameda - Praça do Chile - Almirante Reis, São Jorge de Arroios, Arroios",https://www.idealista.pt/en/imovel/34091261/
170 m²,T1,"1,100€/month","rua Pinto Ferreira, 59, Centro, Belém",https://www.idealista.pt/en/imovel/33375545/
142 m²,T1,"1,093€/month","rua do Cruzeiro, Alto de Alcântara, Alcântara",https://www.idealista.pt/en/imovel/34091253/
143 m²,T1,"1,050€/month","rua do Telhal, Campo de Santana - Santa Marta, Santo António",https://www.idealista.pt/en/imovel/34091242/
140 m²,T1,"1,050€/month","largo Severa, Mouraria - Castelo, Santa Maria Maior",https://www.idealista.pt/en/imovel/34091227/
142 m²,T1,"1,000€/month","rua Dom Domingos Jardo, Alto de São João - Alto do Varejão, Penha de França",https://www.idealista.pt/en/imovel/34091236/
143 m²,T1,"1,000€/month","rua Alexandre O'Neill, Junqueira, Alcântara",https://www.idealista.pt/en/imovel/34091226/
143 m²,T1,"1,000€/month",,https://www.idealista.pt/en/imovel/34091123/
144 m²,T1,800€/month,"rua da Verónica, São Vicente de Fora, São Vicente",https://www.idealista.pt/en/imovel/34091206/
265 m²,T2,"1,200€/month","rua Heróis de Quionga, 61, Alameda - Praça do Chile - Almirante Reis, São Jorge de Arroios, Arroios",https://www.idealista.pt/en/imovel/34090906/
170 m²,T1,"2,000€/month","rua de São Bento, Príncipe Real - São Bento, Misericórdia",https://www.idealista.pt/en/imovel/34090888/
280 m²,T2,"1,500€/monthParking included","rua do Tamisa, Expo Norte, Parque das Nações",https://www.idealista.pt/en/imovel/34090883/
2113 m²,T2,"1,295€/monthParking included","rua Jaime Lopes Dias, Quinta dos Alcoutins, Lumiar",https://www.idealista.pt/en/imovel/34090870/
192 m²,T1,"1,800€/month","rua Marcos Portugal, 23, Príncipe Real - São Bento, Misericórdia",https://www.idealista.pt/en/imovel/34090828/
270 m²,T2,"1,300€/monthParking included","rua Prista Monteiro, 12 , 4 andar, Telheiras, Carnide",https://www.idealista.pt/en/imovel/34090337/
285 m²,T2,"1,300€/month","Estrada de Benfica, São Domingos de Benfica",https://www.idealista.pt/en/imovel/34090773/
285 m²,T2,"5,000€/month","rua de Moçambique, Anjos, Arroios",https://www.idealista.pt/en/imovel/34090823/
250 m²,T2,"6,333€/month","rua de Santa Justa, Baixa, Santa Maria Maior",https://www.idealista.pt/en/imovel/34090813/
150 m²,T1,"5,600€/month","rua do Crucifixo, Baixa, Santa Maria Maior",https://www.idealista.pt/en/imovel/34090812/
145 m²,T1,"3,933€/month",,https://www.idealista.pt/en/imovel/34090810/
260 m²,T2,"2,733€/month","rua Cavaleiro de Oliveira, Alameda - Praça do Chile - Almirante Reis, São Jorge de Arroios, Arroios",https://www.idealista.pt/en/imovel/34090800/
150 m²,T1,"1,450€/month","beco do Forno do Castelo, Mouraria - Castelo, Santa Maria Maior",https://www.idealista.pt/en/imovel/34090796/
282 m²,T2,"1,250€/month","estrada da Luz, Telheiras, Carnide",https://www.idealista.pt/en/imovel/34090794/
2101 m²,T2,"1,750€/month","avenida Marechal Francisco da Costa Gomes, Alto de São João - Alto do Varejão, Penha de França",https://www.idealista.pt/en/imovel/34090793/
268 m²,T2,"2,000€/month","Beato, Lisboa",https://www.idealista.pt/en/imovel/34090434/
141 m²,T1,"1,200€/month",,https://www.idealista.pt/en/imovel/34090433/
275 m²,T2,"1,450€/month","Santa Isabel, Campo de Ourique",https://www.idealista.pt/en/imovel/31215354/
267 m²,T2,"1,150€/month","praça de Bilene, Olivais, Lisboa",https://www.idealista.pt/en/imovel/34090288/
1120 m²,T1,"2,500€/month","avenida Conde de Valbom, 76, Gulbenkian - Praça Espanha, Avenidas Novas",https://www.idealista.pt/en/imovel/34090305/
144 m²,T1,900€/month,"rua Lucinda Simões, Alameda - Praça do Chile - Almirante Reis, São Jorge de Arroios, Arroios",https://www.idealista.pt/en/imovel/34090237/
144 m²,T1,893€/month,"rua Major Neutel de Abreu, Alto dos Moinhos, São Domingos de Benfica",https://www.idealista.pt/en/imovel/34090232/
144 m²,T1,850€/month,"rua da Esperança, Santos-o-Velho - Madragoa, Estrela",https://www.idealista.pt/en/imovel/34090208/
144 m²,T1,800€/month,"rua da Verónica, São Vicente de Fora, São Vicente",https://www.idealista.pt/en/imovel/34090205/
144 m²,T1,800€/month,"rua da Verónica, São Vicente de Fora, São Vicente",https://www.idealista.pt/en/imovel/34090209/
265 m²,T2,"1,300€/month","travessa Santo António a Belém, Centro, Belém",https://www.idealista.pt/en/imovel/34089904/
271 m²,T2,"1,550€/month","rua da Senhora do Monte, Graça, São Vicente",https://www.idealista.pt/en/imovel/34089903/
171 m²,T1,"1,350€/monthParking included","rua Francisco Lyon de Castro, Entrecampos, Avenidas Novas",https://www.idealista.pt/en/imovel/34089871/
2115 m²,T2,"1,740€/month","rua Aristides de Sousa Mendes, Telheiras, Carnide",https://www.idealista.pt/en/imovel/34089830/
265 m²,T2,"1,600€/month","rua da Senhora da Glória, Graça, São Vicente",https://www.idealista.pt/en/imovel/34089778/
2110 m²,T2,"1,500€/month","Entrecampos, Avenidas Novas",https://www.idealista.pt/en/imovel/34089740/
290 m²,T2,"2,200€/month","rua Leite de Vasconcelos, Santa Engrácia, São Vicente",https://www.idealista.pt/en/imovel/34089691/
265 m²,T2,"1,500€/monthParking included",,https://www.idealista.pt/en/imovel/34089709/
170 m²,T1,"1,450€/monthParking included","alameda dos Oceanos, 112, Expo Norte, Parque das Nações",https://www.idealista.pt/en/imovel/34089606/
255 m²,T2,"1,400€/month","beco do Castelo, Mouraria - Castelo, Santa Maria Maior",https://www.idealista.pt/en/imovel/34089625/
162 m²,T1,"1,600€/month","rua Barros Queirós, Rossio - Martim Moniz, Santa Maria Maior",https://www.idealista.pt/en/imovel/33739311/
162 m²,T1,"1,595€/month","alameda dos Oceanos, Nn, Expo Central, Parque das Nações",https://www.idealista.pt/en/imovel/34089186/
2118 m²,T2,"1,900€/monthParking included2,000 €5%","avenida Miguel Torga, 14, Nova Campolide, Campolide",https://www.idealista.pt/en/imovel/34088796/
188 m²,T1,"1,350€/monthParking included","rua Gregório Lopes, 1522, Restelo, Belém",https://www.idealista.pt/en/imovel/34088969/
170 m²,T1,"1,700€/monthParking included","rua do Diário de Notícias, 58, Bairro Alto, Misericórdia",https://www.idealista.pt/en/imovel/34088402/
160 m²,T1,"4,200€/month","rua São José, Av. da Liberdade - Marquês de Pombal, Santo António",https://www.idealista.pt/en/imovel/34089060/
2115 m²,T2,"5,800€/month","rua São José, Av. da Liberdade - Marquês de Pombal, Santo António",https://www.idealista.pt/en/imovel/34089055/
250 m²,T2,"7,667€/month","rua do Carmo, Chiado, Santa Maria Maior",https://www.idealista.pt/en/imovel/34089038/
250 m²,T2,"6,333€/month","rua de Santa Justa, Baixa, Santa Maria Maior",https://www.idealista.pt/en/imovel/34089031/
144 m²,T1,"3,306€/month","rua Vítor Cordon, Chiado, Santa Maria Maior",https://www.idealista.pt/en/imovel/34089022/
282 m²,T2,"2,500€/month","rua das Trinas, Lapa, Estrela",https://www.idealista.pt/en/imovel/34089021/
170 m²,T1,"1,650€/month",,https://www.idealista.pt/en/imovel/34089002/
288 m²,T2,"1,950€/month","avenida Engenheiro Arantes e Oliveira, Olaias, Areeiro",https://www.idealista.pt/en/imovel/34088989/
165 m²,T1,"1,650€/month","avenida Dom João II, 25, Expo Central, Parque das Nações",https://www.idealista.pt/en/imovel/34088096/
140 m²,T1,"1,050€/month","rua da Paz, Príncipe Real - São Bento, Misericórdia",https://www.idealista.pt/en/imovel/34088315/
1100 m²,T1,"1,800€/month",,https://www.idealista.pt/en/imovel/34088055/
145 m²,T1,990€/month,"rua Pedro Dias, Príncipe Real - São Bento, Misericórdia",https://www.idealista.pt/en/imovel/34088101/
295 m²,T2,"1,650€/monthParking included","Entrecampos, Avenidas Novas",https://www.idealista.pt/en/imovel/34088062/
165 m²,T1,"1,600€/month","passeio da Vila Expo, 13, Expo Central, Parque das Nações",https://www.idealista.pt/en/imovel/34087760/
185 m²,T1,"2,200€/monthParking included","Campo de Santana - Santa Marta, Santo António",https://www.idealista.pt/en/imovel/34087681/
282 m²,T2,"1,800€/monthParking included","Lapa, Estrela",https://www.idealista.pt/en/imovel/34087679/
2145 m²,T2,"4,200€/month","rua de São Paulo, Cais do Sodré - Santos, Misericórdia",https://www.idealista.pt/en/imovel/33466095/
146 m²,T1,"1,100€/month",,https://www.idealista.pt/en/imovel/34087561/
169 m²,T1,"1,150€/monthParking included",,https://www.idealista.pt/en/imovel/34087502/
164 m²,T1,"1,300€/month","avenida General Roçadas, 143, Centro, Penha de França",https://www.idealista.pt/en/imovel/28735898/
2200 m²,T2,"2,100€/monthParking included","rua Nova dos Mercadores, Nn, Expo Sul, Parque das Nações",https://www.idealista.pt/en/imovel/34087277/
2150 m²,T2,"1,250€/month","rua Adelaide Cabete, 3, Centro Histórico - Quinta da Luz, Carnide",https://www.idealista.pt/en/imovel/33655161/
2164 m²,T2,"3,400€/monthParking included","Saldanha - Picoas, São Jorge de Arroios, Arroios",https://www.idealista.pt/en/imovel/34087185/
2106 m²,T2,"1,650€/monthParking included","rua do Volga, Expo Norte, Parque das Nações",https://www.idealista.pt/en/imovel/34087156/
1127 m²,T1,"2,400€/monthParking included","Bairro dos Actores - Barão Sabrosa, Penha de França",https://www.idealista.pt/en/imovel/34087124/
170 m²,T1,"2,750€/month","avenida Duque de Ávila, Saldanha - Picoas, São Jorge de Arroios, Arroios",https://www.idealista.pt/en/imovel/34087067/
280 m²,T2,"2,079€/month",,https://www.idealista.pt/en/imovel/34087038/
160 m²,T1,"2,000€/month","rua das Praças, Lapa, Estrela",https://www.idealista.pt/en/imovel/34087018/
270 m²,T2,"2,000€/month","beco Birbantes, Pena, Arroios",https://www.idealista.pt/en/imovel/34087037/
155 m²,T1,"1,950€/month","travessa dos Inglesinhos, Bairro Alto, Misericórdia",https://www.idealista.pt/en/imovel/34087055/
268 m²,T2,"1,950€/month","rua Luís Fernandes, Príncipe Real - São Bento, Misericórdia",https://www.idealista.pt/en/imovel/34087075/
142 m²,T1,"1,900€/month","rua Maria, Anjos, Arroios",https://www.idealista.pt/en/imovel/34087044/
245 m²,T2,"1,900€/month","avenida 5 de Outubro, Campo Pequeno, Avenidas Novas",https://www.idealista.pt/en/imovel/34087073/
143 m²,T1,"1,850€/month","rua da Rosa, Bairro Alto, Misericórdia",https://www.idealista.pt/en/imovel/34087072/
160 m²,T1,"1,760€/month","rua Domingos Sequeira, Lapa, Estrela",https://www.idealista.pt/en/imovel/34087060/
2100 m²,T2,"1,750€/month","praça de Londres, Centro, Areeiro",https://www.idealista.pt/en/imovel/34087049/
264 m²,T2,"1,700€/month","rua Actor João Rosa, Bairro dos Actores, Areeiro",https://www.idealista.pt/en/imovel/34087012/
270 m²,T2,"1,700€/month","rua Heróis de Quionga, Centro, Penha de França",https://www.idealista.pt/en/imovel/34087032/
265 m²,T2,"1,650€/month","rua da Palma, Rossio - Martim Moniz, Santa Maria Maior",https://www.idealista.pt/en/imovel/34087031/
150 m²,T1,"1,600€/month","beco Carrasco, Santa Catarina, Misericórdia",https://www.idealista.pt/en/imovel/34086968/
165 m²,T1,"1,550€/month","rua Professor Francisco Gentil, Telheiras, Lumiar",https://www.idealista.pt/en/imovel/34087005/
165 m²,T1,"1,550€/month","rua General Taborda, Centro, Campolide",https://www.idealista.pt/en/imovel/34087021/
265 m²,T2,"1,500€/month","rua Ferreira Chaves, Centro, Campolide",https://www.idealista.pt/en/imovel/34086967/
179 m²,T1,"1,500€/month","avenida José Malhoa, Praça de Espanha - Sete Rios, Campolide",https://www.idealista.pt/en/imovel/34087019/
143 m²,T1,"1,500€/month","rua de Santo António da Glória, Praça da Alegria, Santo António",https://www.idealista.pt/en/imovel/34087004/
260 m²,T2,"1,500€/month","travessa São Bernardino, Pena, Arroios",https://www.idealista.pt/en/imovel/34086996/
165 m²,T1,"1,500€/month","rua do Olival, Lapa, Estrela",https://www.idealista.pt/en/imovel/34086995/
185 m²,T1,"1,500€/month","travessa Paulo Martins, Calçada da Ajuda - Belém, Ajuda",https://www.idealista.pt/en/imovel/34087009/
170 m²,T1,"1,450€/month","rua Angelina Vidal, Graça, São Vicente",https://www.idealista.pt/en/imovel/34086966/
260 m²,T2,"1,450€/month","largo das Olarias, Mouraria - Castelo, Santa Maria Maior",https://www.idealista.pt/en/imovel/34086986/
245 m²,T2,"1,450€/month","travessa do Forno aos Anjos, Anjos, Arroios",https://www.idealista.pt/en/imovel/34086888/
142 m²,T1,"1,420€/month","rua do Lumiar, Carriche - Hospital das Forças Armadas, Lumiar",https://www.idealista.pt/en/imovel/34086993/
250 m²,T2,"1,400€/month","rua Castelo Branco Saraiva, Centro, Penha de França",https://www.idealista.pt/en/imovel/34086965/
150 m²,T1,"1,400€/month","rua do Sol a Santa Catarina, Santa Catarina, Misericórdia",https://www.idealista.pt/en/imovel/34086964/
149 m²,T1,"1,380€/month","rua de Gustavo de Matos Sequeira, Rato - Amoreiras, Santo António",https://www.idealista.pt/en/imovel/34086980/
145 m²,T1,"1,300€/month","rua Sol a Chelas, Bairro dos Actores - Barão Sabrosa, Penha de França",https://www.idealista.pt/en/imovel/34086978/
150 m²,T1,"1,300€/month","travessa das Inglesinhas, Santos-o-Velho - Madragoa, Estrela",https://www.idealista.pt/en/imovel/34086977/
160 m²,T1,"1,300€/month","largo dos Trigueiros, Mouraria - Castelo, Santa Maria Maior",https://www.idealista.pt/en/imovel/34086976/
264 m²,T2,"1,300€/month","praça João de Azevedo Coutinho, Alto de São João - Alto do Varejão, Penha de França",https://www.idealista.pt/en/imovel/34086975/
160 m²,T1,"1,295€/month","rua do Embaixador, Centro, Belém",https://www.idealista.pt/en/imovel/34086944/
142 m²,T1,"1,200€/month","rua Conde das Antas, Centro, Campolide",https://www.idealista.pt/en/imovel/34086961/
190 m²,T1,"1,200€/month","rua Luís Pastor de Macedo, Alto do Lumiar - Quinta das Conchas - Quinta do Lambert, Lumiar",https://www.idealista.pt/en/imovel/34086970/
262 m²,T2,"1,200€/month",,https://www.idealista.pt/en/imovel/34086938/
140 m²,T1,"1,200€/month",,https://www.idealista.pt/en/imovel/34086928/
165 m²,T1,"1,150€/month",,https://www.idealista.pt/en/imovel/34086941/
143 m²,T1,"1,150€/month","rua Martin Luther King, Santa Clara, Lisboa",https://www.idealista.pt/en/imovel/34086881/
245 m²,T2,"1,000€/month","rua Academia das Ciências, Príncipe Real - São Bento, Misericórdia",https://www.idealista.pt/en/imovel/34086911/
144 m²,T1,"1,000€/month","avenida Elias Garcia, Campo Pequeno, Avenidas Novas",https://www.idealista.pt/en/imovel/34086907/
143 m²,T1,990€/month,"rua Capitão Renato Baptista, Anjos, Arroios",https://www.idealista.pt/en/imovel/34086905/
145 m²,T1,900€/month,"travessa do Conde de Avintes, São Vicente de Fora, São Vicente",https://www.idealista.pt/en/imovel/34086872/
152 m²,T1,900€/month,"rua Dom Tomás de Melo Breyner, Beato, Lisboa",https://www.idealista.pt/en/imovel/34086871/
143 m²,T1,850€/month,"rua do Jardim à Estrela, Lapa, Estrela",https://www.idealista.pt/en/imovel/34086743/
143 m²,T1,700€/month,"travessa do Rosário de Santa Clara, São Vicente de Fora, São Vicente",https://www.idealista.pt/en/imovel/34086592/
2120 m²,T2,"2,750€/monthParking included","rua Professor Sousa da Câmara, Centro, Campolide",https://www.idealista.pt/en/imovel/34085971/
295 m²,T2,"1,700€/monthParking included","rua Comandante Cousteau, Expo Norte, Parque das Nações",https://www.idealista.pt/en/imovel/34085436/
160 m²,T1,"2,750€/month","rua Manuel Marques, Alto do Lumiar - Quinta das Conchas - Quinta do Lambert, Lumiar",https://www.idealista.pt/en/imovel/33948297/
180 m²,T1,"1,980€/month","largo das Olarias, Mouraria - Castelo, Santa Maria Maior",https://www.idealista.pt/en/imovel/33947788/
155 m²,T1,"2,850€/month","avenida Marquês de Tomar, Gulbenkian - Praça Espanha, Avenidas Novas",https://www.idealista.pt/en/imovel/33948256/
140 m²,T1,"1,400€/month1,600 €13%","travessa do Calado, Centro, Penha de França",https://www.idealista.pt/en/imovel/33947697/
263 m²,T2,"4,000€/month","rua do Poço dos Negros, Santa Catarina, Misericórdia",https://www.idealista.pt/en/imovel/33948449/
165 m²,T1,"1,300€/month","rua Braamcamp Freire, Alto de São João - Alto do Varejão, Penha de França",https://www.idealista.pt/en/imovel/33947418/
285 m²,T2,"2,000€/month","rua Rodrigues de Faria, Largo do Calvário - Lx Factory, Alcântara",https://www.idealista.pt/en/imovel/33947972/
143 m²,T1,"2,200€/month","rua Nova do Desterro, Pena, Arroios",https://www.idealista.pt/en/imovel/33948099/
155 m²,T1,"1,200€/month1,300 €8%","rua Dom Carlos de Mascarenhas, Centro, Campolide",https://www.idealista.pt/en/imovel/33947389/
2130 m²,T2,"1,750€/month","Av. de Roma - Campo Pequeno, Areeiro",https://www.idealista.pt/en/imovel/34085211/
262 m²,T2,"1,550€/month","rua General Justiniano Padrel, Santa Engrácia, São Vicente",https://www.idealista.pt/en/imovel/33947634/
2120 m²,T2,"2,700€/month","rua Artilharia 1, Rato - Amoreiras, Santo António",https://www.idealista.pt/en/imovel/33948269/
144 m²,T1,"1,420€/month","rua do Lumiar, Carriche - Hospital das Forças Armadas, Lumiar",https://www.idealista.pt/en/imovel/33947503/
144 m²,T1,"1,600€/month","rua Actor Vale, Bairro dos Actores - Barão Sabrosa, Penha de França",https://www.idealista.pt/en/imovel/33947654/
263 m²,T2,"1,400€/month",,https://www.idealista.pt/en/imovel/33947450/
142 m²,T1,"1,500€/month","rua da Penha de França, Centro, Penha de França",https://www.idealista.pt/en/imovel/33947567/
275 m²,T2,"1,875€/month","rua da Páscoa, Santa Isabel, Campo de Ourique",https://www.idealista.pt/en/imovel/33947889/
160 m²,T1,"2,050€/month","rua de São Miguel, Alfama, Santa Maria Maior",https://www.idealista.pt/en/imovel/33948031/
155 m²,T1,"1,800€/month","rua Ilha do Príncipe, Anjos, Arroios",https://www.idealista.pt/en/imovel/33947840/
146 m²,T1,"1,100€/month","rua Frederico Perry Vidal, Nn, Beato, Lisboa",https://www.idealista.pt/en/imovel/34085045/
160 m²,T1,"1,300€/month","rua Barão de Sabrosa, Bairro dos Actores - Barão Sabrosa, Penha de França",https://www.idealista.pt/en/imovel/33947380/
169 m²,T1,"1,650€/monthParking included","alameda dos Oceanos, 19, Expo Central, Parque das Nações",https://www.idealista.pt/en/imovel/34085011/
2102 m²,T2,"2,400€/month","rua do Garcia, Bairro Calçada dos Mestres, Campolide",https://www.idealista.pt/en/imovel/34084984/
155 m²,T1,"1,860€/month","rua João de Oliveira Miguens, 76, Doca de Alcântara, Estrela",https://www.idealista.pt/en/imovel/34084446/
142 m²,T1,895€/month,"avenida de Madrid, 12, Centro, Areeiro",https://www.idealista.pt/en/imovel/34075368/
2120 m²,T2,"2,750€/monthParking included","rua Professor Sousa da Câmara, Centro, Campolide",https://www.idealista.pt/en/imovel/34084311/
145 m²,T1,950€/month,"Rato - Amoreiras, Santo António",https://www.idealista.pt/en/imovel/34084002/
160 m²,T1,"1,200€/monthParking included","rua Prista Monteiro, 15 loteandar, Telheiras, Carnide",https://www.idealista.pt/en/imovel/34082630/
269 m²,T2,"1,175€/month","Bairro de Santa Cruz, Benfica",https://www.idealista.pt/en/imovel/34083156/
2186 m²,T2,"2,100€/monthParking included","Santa Clara, Lisboa",https://www.idealista.pt/en/imovel/34083077/
281 m²,T2,"1,200€/month","rua Cândido Figueiredo, Estrada de Benfica, São Domingos de Benfica",https://www.idealista.pt/en/imovel/34081778/
184 m²,T1,"1,750€/monthParking included","rua Gonçalves Crespo, Nn, Estefânia, São Jorge de Arroios, Arroios",https://www.idealista.pt/en/imovel/34081378/
161 m²,T1,"1,400€/monthParking included","rua Luciano Freire, 18, Entrecampos, Avenidas Novas",https://www.idealista.pt/en/imovel/34080291/
250 m²,T2,"1,300€/month","rua do Paraíso, 108, São Vicente de Fora, São Vicente",https://www.idealista.pt/en/imovel/32287004/
291 m²,T2,"1,400€/month","estrada de Benfica, Estrada de Benfica, São Domingos de Benfica",https://www.idealista.pt/en/imovel/34080280/
2114 m²,T2,"4,200€/month","Lapa, Estrela",https://www.idealista.pt/en/imovel/34080142/
148 m²,T1,"1,600€/month","rua Infantaria 16, 85, Centro, Campo de Ourique",https://www.idealista.pt/en/imovel/32414465/
266 m²,T2,"1,400€/month","Alto de Alcântara, Alcântara",https://www.idealista.pt/en/imovel/34080073/
2110 m²,T2,"1,500€/month","avenida Almirante Gago Coutinho, 101, São João de Brito, Alvalade",https://www.idealista.pt/en/imovel/34079533/
170 m²,T1,"1,450€/monthParking included","rua Manuel Marques, Alto do Lumiar - Quinta das Conchas - Quinta do Lambert, Lumiar",https://www.idealista.pt/en/imovel/34079902/
270 m²,T2,"1,250€/month",,https://www.idealista.pt/en/imovel/34079623/
265 m²,T2,"1,800€/month",,https://www.idealista.pt/en/imovel/34079390/
166 m²,T1,"1,250€/month","rua da Arrábida, Nn, Santa Isabel, Campo de Ourique",https://www.idealista.pt/en/imovel/34079392/
180 m²,T1,"1,300€/month","avenida do Brasil, São João de Brito, Alvalade",https://www.idealista.pt/en/imovel/34078682/
276 m²,T2,"1,600€/month","rua Francisco Sanches, Alameda - Praça do Chile - Almirante Reis, São Jorge de Arroios, Arroios",https://www.idealista.pt/en/imovel/34077234/
270 m²,T2,"1,500€/month","rua Rodrigues de Faria, 105, Largo do Calvário - Lx Factory, Alcântara",https://www.idealista.pt/en/imovel/33151632/
286 m²,T2,"1,400€/month","estrada de Benfica, Nn, Fonte Nova - Calhariz, Benfica",https://www.idealista.pt/en/imovel/34074289/
290 m²,T2,"1,600€/month","Mouraria - Castelo, Santa Maria Maior",https://www.idealista.pt/en/imovel/34074088/
155 m²,T1,"1,200€/month","Campo Pequeno, Avenidas Novas",https://www.idealista.pt/en/imovel/34073626/
2114 m²,T2,"1,900€/monthParking included","Alto dos Moinhos, São Domingos de Benfica",https://www.idealista.pt/en/imovel/34072713/
260 m²,T2,"1,650€/month","rua Damasceno Monteiro, 64, Anjos, Arroios",https://www.idealista.pt/en/imovel/34071398/
265 m²,T2,"1,300€/month","rua Angelina Vidal, 42, Centro, Penha de França",https://www.idealista.pt/en/imovel/34071081/
149 m²,T1,"1,750€/monthParking included","avenida Elias Garcia, 67, Campo Pequeno, Avenidas Novas",https://www.idealista.pt/en/imovel/34068323/
262 m²,T2,"2,100€/month","rua das Pedreiras, Centro, Belém",https://www.idealista.pt/en/imovel/34059669/
144 m²,T1,800€/month,"travessa do Rosário de Santa Clara, São Vicente de Fora, São Vicente",https://www.idealista.pt/en/imovel/34064968/
298 m²,T2,"1,090€/month","rua do Embaixador, 124, Centro, Belém",https://www.idealista.pt/en/imovel/33864529/
159 m²,T1,"1,400€/month1,500 €7%","avenida Conselheiro Fernando de Sousa, Centro, Campolide",https://www.idealista.pt/en/imovel/33940798/
261 m²,T2,"1,000€/month","rua Dom Fuas Roupinho, Alto de São João - Alto do Varejão, Penha de França",https://www.idealista.pt/en/imovel/34070846/
2100 m²,T2,"3,150€/monthParking included","rua Alexandre Herculano, Rato - Amoreiras, Santo António",https://www.idealista.pt/en/imovel/34070252/
284 m²,T2,"1,300€/month","rua Saraiva de Carvalho, Largo do Rato - Estrela, Campo de Ourique",https://www.idealista.pt/en/imovel/34068934/
140 m²,T1,"1,200€/month1,350 €11%","caminho de Palma de Cima, 2, Laranjeiras, São Domingos de Benfica",https://www.idealista.pt/en/imovel/34071308/
2134 m²,T2,"3,200€/month3,500 €9%","largo das Palmeiras, Nn, Saldanha - Picoas, São Jorge de Arroios, Arroios",https://www.idealista.pt/en/imovel/33865999/
171 m²,T1,"1,300€/month","avenida General Roçadas, Nn, Centro, Penha de França",https://www.idealista.pt/en/imovel/34070915/
296 m²,T2,"3,350€/month","Largo do Rato - Estrela, Campo de Ourique",https://www.idealista.pt/en/imovel/34074193/
264 m²,T2,"1,300€/month","rua Dom Fuas Roupinho, 26, Alto de São João - Alto do Varejão, Penha de França",https://www.idealista.pt/en/imovel/34073627/
160 m²,T1,"3,867€/month4,200 €8%","rua São José, Av. da Liberdade - Marquês de Pombal, Santo António",https://www.idealista.pt/en/imovel/34053308/
2104 m²,T2,"2,500€/monthParking included","estrada das Laranjeiras, 130, Sete Rios, São Domingos de Benfica",https://www.idealista.pt/en/imovel/33896201/
2168 m²,T2,"3,500€/month","Praça da Alegria, Santo António",https://www.idealista.pt/en/imovel/34070225/
2119 m²,T2,"2,450€/monthParking included","praceta Teófilo Ferreira, Largo do Calvário - Lx Factory, Alcântara",https://www.idealista.pt/en/imovel/34083290/
276 m²,T2,"1,100€/month",,https://www.idealista.pt/en/imovel/34070246/
154 m²,T1,"1,200€/month","rua Cláudio Nunes, Nn, Arneiros, Benfica",https://www.idealista.pt/en/imovel/34068028/
