size,num_rooms,rent_price,location,url
150 m²,T1,"2,700€/month","rua Pereira e Sousa, Centro, Campo de Ourique",https://www.idealista.pt/en/imovel/34045716/
165 m²,T1,"3,500€/month","rua do Alviela, Santa Engrácia, São Vicente",https://www.idealista.pt/en/imovel/34045881/
144 m²,T1,"1,395€/month",,https://www.idealista.pt/en/imovel/34038542/
143 m²,T1,"2,250€/month","rua do Salitre, Av. da Liberdade - Marquês de Pombal, Santo António",https://www.idealista.pt/en/imovel/34040109/
290 m²,T2,"2,500€/month","rua Lucília do Carmo, Caselas, Belém",https://www.idealista.pt/en/imovel/34045399/
160 m²,T1,"1,750€/month","avenida General Roçadas, Centro, Penha de França",https://www.idealista.pt/en/imovel/34039662/
190 m²,T1,"1,800€/month","rua Helena Vaz da Silva, Alto do Lumiar - Quinta das Conchas - Quinta do Lambert, Lumiar",https://www.idealista.pt/en/imovel/34045223/
262 m²,T2,"5,000€/month","avenida Fontes Pereira de Melo, São Sebastião da Pedreira, Avenidas Novas",https://www.idealista.pt/en/imovel/34045934/
263 m²,T2,"2,100€/month","rua Sebastião Saraiva Lima, Centro, Penha de França",https://www.idealista.pt/en/imovel/34040131/
166 m²,T1,"2,090€/month","rua Frederico de Brito, Santa Clara, Lisboa",https://www.idealista.pt/en/imovel/34040103/
175 m²,T1,"1,400€/month","travessa Henrique Cardoso, Alvalade, Alvalade",https://www.idealista.pt/en/imovel/34038551/
255 m²,T2,"1,600€/month","rua Conde das Antas, Centro, Campolide",https://www.idealista.pt/en/imovel/34039326/
262 m²,T2,"2,500€/month",,https://www.idealista.pt/en/imovel/34045374/
290 m²,T2,"2,300€/month","avenida do Brasil, Campo Grande, Alvalade",https://www.idealista.pt/en/imovel/34045287/
160 m²,T1,"2,050€/month","rua da Verónica, São Vicente de Fora, São Vicente",https://www.idealista.pt/en/imovel/34039987/
162 m²,T1,"1,500€/month","rua Francisco de Assis Rodrigues, Centro, Campolide",https://www.idealista.pt/en/imovel/34039153/
142 m²,T1,"1,700€/month","rua Conde das Antas, Centro, Campolide",https://www.idealista.pt/en/imovel/34045177/
147 m²,T1,"2,000€/month","rua Angelina Vidal, Anjos, Arroios",https://www.idealista.pt/en/imovel/34040016/
260 m²,T2,"1,650€/month","travessa da Memória, Calçada da Ajuda - Belém, Ajuda",https://www.idealista.pt/en/imovel/34039277/
150 m²,T1,"2,200€/month","rua de Martim Vaz, Pena, Arroios",https://www.idealista.pt/en/imovel/34045208/
255 m²,T2,"1,300€/month","beco dos Cativos, Alfama, Santa Maria Maior",https://www.idealista.pt/en/imovel/34038459/
160 m²,T1,"1,850€/month","beco dos Peixinhos, Graça, São Vicente",https://www.idealista.pt/en/imovel/34039885/
270 m²,T2,"2,800€/month","rua de São Lázaro, Pena, Arroios",https://www.idealista.pt/en/imovel/34045742/
255 m²,T2,"1,700€/month","rua Sebastião Saraiva Lima, Centro, Penha de França",https://www.idealista.pt/en/imovel/34039495/
264 m²,T2,"1,825€/month",,https://www.idealista.pt/en/imovel/34045216/
290 m²,T2,"3,000€/month","rua Neves Ferreira, Centro, Penha de França",https://www.idealista.pt/en/imovel/34045790/
155 m²,T1,"2,352€/month","estrada Moscavide, Gare do Oriente - Zona Sul, Parque das Nações",https://www.idealista.pt/en/imovel/34045295/
143 m²,T1,"1,200€/month","rua das Madres, Santos-o-Velho - Madragoa, Estrela",https://www.idealista.pt/en/imovel/34064977/
280 m²,T2,"2,700€/month","rua do Cardal de São José, Campo de Santana - Santa Marta, Santo António",https://www.idealista.pt/en/imovel/34045686/
165 m²,T1,"2,700€/month","rua do Olival, Lapa, Estrela",https://www.idealista.pt/en/imovel/34045715/
144 m²,T1,"1,195€/month","rua Eugénio de Castro, Campo Grande, Alvalade",https://www.idealista.pt/en/imovel/34036992/
150 m²,T1,"1,750€/month","rua das Praças, Lapa, Estrela",https://www.idealista.pt/en/imovel/34039666/
140 m²,T1,"1,800€/month","travessa da Espera, Bairro Alto, Misericórdia",https://www.idealista.pt/en/imovel/34039734/
2110 m²,T2,"3,250€/month","rua Garrett, Chiado, Santa Maria Maior",https://www.idealista.pt/en/imovel/34045788/
250 m²,T2,"1,750€/month","rua do Terreirinho, Mouraria - Castelo, Santa Maria Maior",https://www.idealista.pt/en/imovel/34039638/
2150 m²,T2,"7,500€/monthParking included","avenida da Liberdade, 49, Praça da Alegria, Santo António",https://www.idealista.pt/en/imovel/34064679/
240 m²,T2,"1,650€/month","travessa da Cruz da Rocha, Lapa, Estrela",https://www.idealista.pt/en/imovel/34039381/
